{
  "$schema": "./modules.schema.json",
  "schemaVersion": 1,
  "distributionVersion": "0.2.0",
  "featureContractVersion": 1,
  "startFeatureId": "messages",
  "modules": [
    {
      "id": "kmp-core",
      "kind": "foundation",
      "coordinate": "io.github.yutakax17.advancedhelloworld:kmp-advanced-hello-world-core",
      "version": "0.1.0"
    },
    {
      "id": "compose-core",
      "kind": "foundation",
      "coordinate": "io.github.yutakax17.advancedhelloworld:compose-advanced-hello-world-core",
      "version": "0.1.0"
    },
    {
      "id": "kmp-messages",
      "kind": "domain",
      "coordinate": "io.github.yutakax17.advancedhelloworld:kmp-advanced-hello-world-messages",
      "version": "0.2.0"
    },
    {
      "id": "messages",
      "kind": "feature",
      "coordinate": "io.github.yutakax17.advancedhelloworld:compose-advanced-hello-world-messages",
      "version": "0.2.0",
      "factoryClass": "io.github.yutakax17.advancedhelloworld.compose.messages.MessagesFeatureFactory",
      "dependenciesClass": "io.github.yutakax17.advancedhelloworld.compose.messages.MessagesUiDependencies"
    }
  ]
}
